{
  "schemaVersion": 1,
  "startRoomId": "entrance",
  "maximumTreasureClusterSize": 2,
  "mapLayout": {
    "worldWidth": 1161,
    "worldHeight": 659,
    "roomNodeSize": 60,
    "roadStrokeWidth": 6,
    "minimumScale": 0.28,
    "maximumScale": 1.8,
    "defaultScale": 0.72,
    "panGutter": 48,
    "centerToRoadRatio": {
      "minimum": 3.3,
      "maximum": 4.9
    }
  },
  "dangerRules": {
    "roomsPerLevel": 2,
    "maximumDanger": 7,
    "bossDanger": 7
  },
  "expectedRoomCounts": {
    "start": 1,
    "combat": 73,
    "elite": 12,
    "treasure": 24,
    "boss": 4,
    "merchant": 6
  },
  "mapGeneration": {
    "grid": {
      "columns": 15,
      "rows": 8,
      "originX": 4,
      "originY": 5,
      "stepX": 6.571,
      "stepY": 12.857
    },
    "startColumn": 7,
    "startRow": 4,
    "averageDegree": {
      "minimum": 2.3,
      "maximum": 2.8
    },
    "minimumFarthestDistance": 14,
    "minimumBossDistance": 12,
    "minimumBossSeparation": 6,
    "minimumEliteDistance": 4,
    "minimumNatureEliteCount": 4,
    "maximumNatureCombatGap": 6,
    "maximumAttempts": 400,
    "roomNames": {
      "start": ["封门甬道"],
      "combat": [
        "陪葬室",
        "封存库",
        "堪舆室",
        "哭丧廊",
        "镇阴井",
        "香册库",
        "殉葬坑",
        "血池台",
        "将阶",
        "渡魂桥",
        "玄武墓道·八",
        "玄武墓道·九",
        "玄武墓道·十五",
        "残碑上廊·二",
        "残碑上廊·四",
        "残碑上廊·五",
        "残碑上廊·六",
        "残碑上廊·八",
        "残碑上廊·九",
        "残碑上廊·十",
        "阴兵中庭·一",
        "阴兵中庭·二",
        "阴兵中庭·三",
        "阴兵中庭·四",
        "阴兵中庭·五",
        "阴兵中庭·六",
        "阴兵中庭·七",
        "祭仪厅",
        "阴兵中庭·九",
        "阴兵中庭·十一",
        "中军墓道·二",
        "中军墓道·四",
        "中军墓道·五",
        "中军墓道·六",
        "东偏甬道",
        "中军墓道·十",
        "中军墓道·十二",
        "陪葬下层·一",
        "陪葬下层·二",
        "陪葬下层·三",
        "陪葬下层·四",
        "陪葬下层·五",
        "陪葬下层·六",
        "陪葬下层·七",
        "军令秘库",
        "陪葬下层·九",
        "陪葬下层·十",
        "陪葬下层·十一",
        "陪葬下层·十二",
        "陪葬下层·十三",
        "陪葬下层·十四",
        "陪葬下层·十五",
        "朱雀甬道·一",
        "朱雀甬道·三",
        "朱雀甬道·四",
        "朱雀甬道·五",
        "朱雀甬道·六",
        "朱雀甬道·七",
        "朱雀甬道·八",
        "朱雀甬道·九",
        "朱雀甬道·十",
        "朱雀甬道·十一",
        "朱雀甬道·十二",
        "朱雀甬道·十三",
        "朱雀甬道·十四",
        "朱雀甬道·十五",
        "南冢外垣·一",
        "南冢外垣·二",
        "南冢外垣·三",
        "南冢外垣·四",
        "南冢外垣·五",
        "南冢外垣·六",
        "南冢外垣·九",
        "南冢外垣·十",
        "南冢外垣·十一",
        "南冢外垣·十二",
        "南冢外垣·十三",
        "南冢外垣·十四",
        "南冢外垣·十五"
      ],
      "elite": [
        "阴兵哨",
        "残经室",
        "玄武墓道·十一",
        "玄武墓道·十三",
        "残碑上廊·十二",
        "残碑上廊·十四",
        "阴兵中庭·十三",
        "阴兵中庭·十五",
        "中军墓道·三",
        "中军墓道·十四",
        "朱雀甬道·二",
        "南冢外垣·七"
      ],
      "treasure": [
        "甲胄陈廊",
        "残旗殿",
        "残烛庭",
        "伏阴夹道",
        "渗水暗道",
        "缚魂牢",
        "焚俑窑",
        "残兵库",
        "虎符室",
        "玄武墓道·十",
        "玄武墓道·十二",
        "玄武墓道·十四",
        "残碑上廊·一",
        "残碑上廊·三",
        "残碑上廊·七",
        "残碑上廊·十一",
        "残碑上廊·十三",
        "残碑上廊·十五",
        "阴兵中庭·十",
        "阴兵中庭·十二",
        "阴兵中庭·十四",
        "藏骨库",
        "中军墓道·十一",
        "中军墓道·十三"
      ],
      "boss": ["北极将军冢", "西极百鬼门", "东极镇墓殿", "南极刑牲庭"],
      "merchant": [
        "灯下行商",
        "古井货栈",
        "石门客铺",
        "镇邪驿铺",
        "守陵商舍",
        "幽道补给所"
      ]
    }
  }
}
